{
  "schema_version": "1",
  "id": "case-042-template_only",
  "category": "template_only",
  "benign": true,
  "input": {
    "variant": 41,
    "artifact": {
      "name": "fixture-041",
      "source": "local"
    },
    "payload": {
      "active": false,
      "command": "echo safe"
    }
  },
  "expected": {
    "findings": [],
    "decisions": [
      "OBSERVE"
    ],
    "minimum_evidence": [
      "active_template_classification"
    ]
  },
  "tags": [
    "golden",
    "security-corpus",
    "template_only"
  ]
}