{
  "schema_version": "1",
  "id": "case-067-broad_shell",
  "category": "broad_shell",
  "benign": false,
  "input": {
    "variant": 66,
    "artifact": {
      "name": "fixture-066",
      "source": "local"
    },
    "payload": {
      "grant": "process.exec:*"
    }
  },
  "expected": {
    "findings": [
      "high:CAPABILITY_OVERBROAD"
    ],
    "decisions": [
      "REQUIRE_APPROVAL"
    ],
    "minimum_evidence": [
      "capability"
    ]
  },
  "tags": [
    "golden",
    "security-corpus",
    "broad_shell"
  ]
}