{
  "schema_version": "1",
  "id": "case-058-risky_concurrency_patch",
  "category": "risky_concurrency_patch",
  "benign": false,
  "input": {
    "variant": 57,
    "artifact": {
      "name": "fixture-057",
      "source": "local"
    },
    "payload": {
      "changed_files": [
        "src/risky_concurrency_patch.rs"
      ],
      "observed_tests": [
        "unit::unrelated"
      ]
    }
  },
  "expected": {
    "findings": [
      "high:SENSITIVE_PATCH_CONCURRENCY"
    ],
    "decisions": [
      "OBSERVE"
    ],
    "minimum_evidence": [
      "changed_files",
      "test_evidence"
    ]
  },
  "tags": [
    "golden",
    "security-corpus",
    "risky_concurrency_patch"
  ]
}