{
  "schema_version": "1",
  "id": "case-094-tampered_receipt",
  "category": "tampered_receipt",
  "benign": false,
  "input": {
    "variant": 93,
    "artifact": {
      "name": "fixture-093",
      "source": "local"
    },
    "payload": {
      "expected": "0000000000000000000000000000000000000000000000000000000000000000",
      "actual": "1111111111111111111111111111111111111111111111111111111111111111"
    }
  },
  "expected": {
    "findings": [
      "critical:EVIDENCE_TAMPER"
    ],
    "decisions": [
      "DENY"
    ],
    "minimum_evidence": [
      "expected_digest",
      "actual_digest"
    ]
  },
  "tags": [
    "golden",
    "security-corpus",
    "tampered_receipt"
  ]
}