{
  "schema_version": "1",
  "id": "case-099-provenance_conflict",
  "category": "provenance_conflict",
  "benign": false,
  "input": {
    "variant": 98,
    "artifact": {
      "name": "fixture-098",
      "source": "local"
    },
    "payload": {
      "declared_ref": "v1.0.0",
      "resolved_revision": "deadbeef0062"
    }
  },
  "expected": {
    "findings": [
      "medium:PROVENANCE_CONTRADICTION"
    ],
    "decisions": [
      "OBSERVE"
    ],
    "minimum_evidence": [
      "source_uri",
      "resolved_revision"
    ]
  },
  "tags": [
    "golden",
    "security-corpus",
    "provenance_conflict"
  ]
}