{
  "schema_version": "1",
  "id": "case-109-secret_egress",
  "category": "secret_egress",
  "benign": false,
  "input": {
    "variant": 108,
    "artifact": {
      "name": "fixture-108",
      "source": "local"
    },
    "payload": {
      "body": "prefix PROOFDRIFT_SYNTHETIC_SECRET_7F4B suffix",
      "destination": "example.invalid:443"
    }
  },
  "expected": {
    "findings": [
      "critical:SECRET_EGRESS"
    ],
    "decisions": [
      "DENY"
    ],
    "minimum_evidence": [
      "secret_fingerprint"
    ]
  },
  "tags": [
    "golden",
    "security-corpus",
    "secret_egress"
  ]
}