{
  "schema_version": "1",
  "id": "case-153-evidence_rollback",
  "category": "evidence_rollback",
  "benign": false,
  "input": {
    "variant": 152,
    "artifact": {
      "name": "hardening-153",
      "source": "synthetic"
    },
    "payload": {
      "expected_sequence": 99,
      "present_sequence": 70
    }
  },
  "expected": {
    "findings": [
      "critical:EVIDENCE_ROLLBACK"
    ],
    "decisions": [
      "DENY"
    ],
    "minimum_evidence": [
      "session_head_hash",
      "present_head_hash"
    ]
  },
  "tags": [
    "golden",
    "security-corpus",
    "hardening",
    "evidence_rollback"
  ]
}